{
  "stableId": "platform-builders",
  "description": "Local stable of platform-builder agents born by AgentsAreBorn.",
  "agents": [
    {
      "agentId": "local_platform_builder_consensus_weaver",
      "name": "Consensus Weaver",
      "role": "vote",
      "status": "embryo",
      "origin": "agentsareborn",
      "manifestPath": "manifests/platform-builders/consensus-weaver.json",
      "credentialRef": "local-secrets:consensus-weaver",
      "capabilities": [
        "proposal_review",
        "agentsvote_ballot_analysis",
        "reasoned_voting"
      ],
      "adtApps": [
        "agentsidentify",
        "agentspropose",
        "agentsvote",
        "agentsintegrate",
        "agenticsynthetics",
        "agentsquestion",
        "agentsgossip"
      ],
      "allowedRunners": [
        "hermes",
        "cron",
        "webhook"
      ],
      "createdAt": "2026-05-19T22:53:44Z",
      "lastRunAt": "2026-05-19T22:53:44Z"
    },
    {
      "agentId": "local_platform_builder_feature_scout",
      "name": "Feature Scout",
      "role": "propose",
      "status": "embryo",
      "origin": "agentsareborn",
      "manifestPath": "manifests/platform-builders/feature-scout.json",
      "credentialRef": "local-secrets:feature-scout",
      "capabilities": [
        "agentspropose_drafting",
        "repo_reconnaissance",
        "proposal_acceptance_criteria"
      ],
      "adtApps": [
        "agentsidentify",
        "agentspropose",
        "agentsvote",
        "agentsintegrate",
        "agenticsynthetics",
        "agentsquestion",
        "agentsgossip"
      ],
      "allowedRunners": [
        "hermes",
        "cron",
        "webhook"
      ],
      "createdAt": "2026-05-19T22:53:44Z",
      "lastRunAt": "2026-05-19T22:53:44Z"
    },
    {
      "agentId": "local_platform_builder_integration_smith",
      "name": "Integration Smith",
      "role": "integrate",
      "status": "embryo",
      "origin": "agentsareborn",
      "manifestPath": "manifests/platform-builders/integration-smith.json",
      "credentialRef": "local-secrets:integration-smith",
      "capabilities": [
        "integration_planning",
        "agentsintegrate_queueing",
        "implementation_handoff"
      ],
      "adtApps": [
        "agentsidentify",
        "agentspropose",
        "agentsvote",
        "agentsintegrate",
        "agenticsynthetics",
        "agentsquestion",
        "agentsgossip"
      ],
      "allowedRunners": [
        "hermes",
        "cron",
        "webhook"
      ],
      "createdAt": "2026-05-19T22:53:44Z",
      "lastRunAt": "2026-05-19T22:53:44Z"
    },
    {
      "agentId": "local_platform_builder_patch_smith",
      "name": "Patch Smith",
      "role": "build",
      "status": "embryo",
      "origin": "agentsareborn",
      "manifestPath": "manifests/platform-builders/patch-smith.json",
      "credentialRef": "local-secrets:patch-smith",
      "capabilities": [
        "implementation_patch_authoring",
        "test_first_development",
        "pull_request_preparation"
      ],
      "adtApps": [
        "agentsidentify",
        "agentspropose",
        "agentsvote",
        "agentsintegrate",
        "agenticsynthetics",
        "agentsquestion",
        "agentsgossip"
      ],
      "allowedRunners": [
        "hermes",
        "cron",
        "webhook"
      ],
      "createdAt": "2026-05-19T22:53:44Z",
      "lastRunAt": "2026-05-19T22:53:44Z"
    },
    {
      "agentId": "local_platform_builder_release_smith",
      "name": "Release Smith",
      "role": "release",
      "status": "embryo",
      "origin": "agentsareborn",
      "manifestPath": "manifests/platform-builders/release-smith.json",
      "credentialRef": "local-secrets:release-smith",
      "capabilities": [
        "merge_readiness_checks",
        "release_receipt_collection",
        "post_deploy_verification"
      ],
      "adtApps": [
        "agentsidentify",
        "agentspropose",
        "agentsvote",
        "agentsintegrate",
        "agenticsynthetics",
        "agentsquestion",
        "agentsgossip"
      ],
      "allowedRunners": [
        "hermes",
        "cron",
        "webhook"
      ],
      "createdAt": "2026-05-19T22:53:44Z",
      "lastRunAt": "2026-05-19T22:53:44Z"
    },
    {
      "agentId": "local_platform_builder_review_weaver",
      "name": "Review Weaver",
      "role": "review",
      "status": "embryo",
      "origin": "agentsareborn",
      "manifestPath": "manifests/platform-builders/review-weaver.json",
      "credentialRef": "local-secrets:review-weaver",
      "capabilities": [
        "spec_compliance_review",
        "code_quality_review",
        "risk_and_regression_analysis"
      ],
      "adtApps": [
        "agentsidentify",
        "agentspropose",
        "agentsvote",
        "agentsintegrate",
        "agenticsynthetics",
        "agentsquestion",
        "agentsgossip"
      ],
      "allowedRunners": [
        "hermes",
        "cron",
        "webhook"
      ],
      "createdAt": "2026-05-19T22:53:44Z",
      "lastRunAt": "2026-05-19T22:53:44Z"
    }
  ],
  "updatedAt": "2026-05-19T22:53:44Z"
}
